{
  "name": "mastered",
  "description": "Addendum 22 의 네 조건을 모두 채운 상태. mastery/confidence 문턱, 최근 독립 풀이 3개 중 2개 이상 성공, 복습 1회 성공.",
  "skillCode": "BFS_GRID_TRAVERSAL",
  "evidences": [
    {
      "evidenceId": "ev_bde7e2628ad7a59ed015122f",
      "sourceEventId": "submission:1",
      "skillCode": "BFS_GRID_TRAVERSAL",
      "evidenceType": "PROBLEM_SUBMISSION",
      "occurredAt": "2026-09-01T10:00:00Z",
      "weight": 1.0,
      "observed": {
        "concept": null,
        "recognition": null,
        "implementation": 0.9,
        "independent": 0.95,
        "retention": null,
        "speed": null
      },
      "sourceConfidence": 1.0,
      "context": {
        "problemCode": null,
        "judgeStatus": "ACCEPTED",
        "hintLevel": 0,
        "solutionViewed": false,
        "independentAttempt": true,
        "reviewSucceeded": null,
        "daysSinceLast": null,
        "verdict": null
      }
    },
    {
      "evidenceId": "ev_ab01c32493cb8bc05ec28de8",
      "sourceEventId": "submission:2",
      "skillCode": "BFS_GRID_TRAVERSAL",
      "evidenceType": "PROBLEM_SUBMISSION",
      "occurredAt": "2026-09-02T10:00:00Z",
      "weight": 1.0,
      "observed": {
        "concept": null,
        "recognition": null,
        "implementation": 0.9,
        "independent": 0.95,
        "retention": null,
        "speed": null
      },
      "sourceConfidence": 1.0,
      "context": {
        "problemCode": null,
        "judgeStatus": "ACCEPTED",
        "hintLevel": 0,
        "solutionViewed": false,
        "independentAttempt": true,
        "reviewSucceeded": null,
        "daysSinceLast": null,
        "verdict": null
      }
    },
    {
      "evidenceId": "ev_f2c3a96ae8669717e7cdc9a2",
      "sourceEventId": "submission:3",
      "skillCode": "BFS_GRID_TRAVERSAL",
      "evidenceType": "PROBLEM_SUBMISSION",
      "occurredAt": "2026-09-03T10:00:00Z",
      "weight": 1.0,
      "observed": {
        "concept": null,
        "recognition": null,
        "implementation": 0.9,
        "independent": 0.95,
        "retention": null,
        "speed": null
      },
      "sourceConfidence": 1.0,
      "context": {
        "problemCode": null,
        "judgeStatus": "ACCEPTED",
        "hintLevel": 0,
        "solutionViewed": false,
        "independentAttempt": true,
        "reviewSucceeded": null,
        "daysSinceLast": null,
        "verdict": null
      }
    },
    {
      "evidenceId": "ev_fc433dd1fa85c94482c9abd6",
      "sourceEventId": "submission:4",
      "skillCode": "BFS_GRID_TRAVERSAL",
      "evidenceType": "PROBLEM_SUBMISSION",
      "occurredAt": "2026-09-04T10:00:00Z",
      "weight": 1.0,
      "observed": {
        "concept": null,
        "recognition": null,
        "implementation": 0.9,
        "independent": 0.95,
        "retention": null,
        "speed": null
      },
      "sourceConfidence": 1.0,
      "context": {
        "problemCode": null,
        "judgeStatus": "ACCEPTED",
        "hintLevel": 0,
        "solutionViewed": false,
        "independentAttempt": true,
        "reviewSucceeded": null,
        "daysSinceLast": null,
        "verdict": null
      }
    },
    {
      "evidenceId": "ev_69f56b989dc1a01d04d98ab8",
      "sourceEventId": "submission:5",
      "skillCode": "BFS_GRID_TRAVERSAL",
      "evidenceType": "PROBLEM_SUBMISSION",
      "occurredAt": "2026-09-05T10:00:00Z",
      "weight": 1.0,
      "observed": {
        "concept": null,
        "recognition": null,
        "implementation": 0.9,
        "independent": 0.95,
        "retention": null,
        "speed": null
      },
      "sourceConfidence": 1.0,
      "context": {
        "problemCode": null,
        "judgeStatus": "ACCEPTED",
        "hintLevel": 0,
        "solutionViewed": false,
        "independentAttempt": true,
        "reviewSucceeded": null,
        "daysSinceLast": null,
        "verdict": null
      }
    },
    {
      "evidenceId": "ev_692c8bb2aa828e9527d9825b",
      "sourceEventId": "submission:6",
      "skillCode": "BFS_GRID_TRAVERSAL",
      "evidenceType": "PROBLEM_SUBMISSION",
      "occurredAt": "2026-09-06T10:00:00Z",
      "weight": 1.0,
      "observed": {
        "concept": null,
        "recognition": null,
        "implementation": 0.9,
        "independent": 0.95,
        "retention": null,
        "speed": null
      },
      "sourceConfidence": 1.0,
      "context": {
        "problemCode": null,
        "judgeStatus": "ACCEPTED",
        "hintLevel": 0,
        "solutionViewed": false,
        "independentAttempt": true,
        "reviewSucceeded": null,
        "daysSinceLast": null,
        "verdict": null
      }
    },
    {
      "evidenceId": "ev_ecc001321bb9adcc940aa4c4",
      "sourceEventId": "submission:7",
      "skillCode": "BFS_GRID_TRAVERSAL",
      "evidenceType": "PROBLEM_SUBMISSION",
      "occurredAt": "2026-09-07T10:00:00Z",
      "weight": 1.0,
      "observed": {
        "concept": null,
        "recognition": null,
        "implementation": 0.9,
        "independent": 0.95,
        "retention": null,
        "speed": null
      },
      "sourceConfidence": 1.0,
      "context": {
        "problemCode": null,
        "judgeStatus": "ACCEPTED",
        "hintLevel": 0,
        "solutionViewed": false,
        "independentAttempt": true,
        "reviewSucceeded": null,
        "daysSinceLast": null,
        "verdict": null
      }
    },
    {
      "evidenceId": "ev_18bcbfd8cd4b56f8ef04ccda",
      "sourceEventId": "submission:8",
      "skillCode": "BFS_GRID_TRAVERSAL",
      "evidenceType": "PROBLEM_SUBMISSION",
      "occurredAt": "2026-09-08T10:00:00Z",
      "weight": 1.0,
      "observed": {
        "concept": null,
        "recognition": null,
        "implementation": 0.9,
        "independent": 0.95,
        "retention": null,
        "speed": null
      },
      "sourceConfidence": 1.0,
      "context": {
        "problemCode": null,
        "judgeStatus": "ACCEPTED",
        "hintLevel": 0,
        "solutionViewed": false,
        "independentAttempt": true,
        "reviewSucceeded": null,
        "daysSinceLast": null,
        "verdict": null
      }
    },
    {
      "evidenceId": "ev_fb10d9d38aaef4c521ba4f62",
      "sourceEventId": "submission:9",
      "skillCode": "BFS_GRID_TRAVERSAL",
      "evidenceType": "PROBLEM_SUBMISSION",
      "occurredAt": "2026-09-09T10:00:00Z",
      "weight": 1.0,
      "observed": {
        "concept": null,
        "recognition": null,
        "implementation": 0.9,
        "independent": 0.95,
        "retention": null,
        "speed": null
      },
      "sourceConfidence": 1.0,
      "context": {
        "problemCode": null,
        "judgeStatus": "ACCEPTED",
        "hintLevel": 0,
        "solutionViewed": false,
        "independentAttempt": true,
        "reviewSucceeded": null,
        "daysSinceLast": null,
        "verdict": null
      }
    },
    {
      "evidenceId": "ev_413e29d2f18e0d3432fe4d75",
      "sourceEventId": "submission:10",
      "skillCode": "BFS_GRID_TRAVERSAL",
      "evidenceType": "PROBLEM_SUBMISSION",
      "occurredAt": "2026-09-10T10:00:00Z",
      "weight": 1.0,
      "observed": {
        "concept": null,
        "recognition": null,
        "implementation": 0.9,
        "independent": 0.95,
        "retention": null,
        "speed": null
      },
      "sourceConfidence": 1.0,
      "context": {
        "problemCode": null,
        "judgeStatus": "ACCEPTED",
        "hintLevel": 0,
        "solutionViewed": false,
        "independentAttempt": true,
        "reviewSucceeded": null,
        "daysSinceLast": null,
        "verdict": null
      }
    },
    {
      "evidenceId": "ev_b72c7bcb9e39f886cdb6b5ee",
      "sourceEventId": "concept:11",
      "skillCode": "BFS_GRID_TRAVERSAL",
      "evidenceType": "CONCEPT_CHECK",
      "occurredAt": "2026-09-11T10:00:00Z",
      "weight": 0.5,
      "observed": {
        "concept": 0.9,
        "recognition": null,
        "implementation": null,
        "independent": null,
        "retention": null,
        "speed": null
      },
      "sourceConfidence": null,
      "context": {
        "problemCode": null,
        "judgeStatus": null,
        "hintLevel": null,
        "solutionViewed": null,
        "independentAttempt": null,
        "reviewSucceeded": null,
        "daysSinceLast": null,
        "verdict": "CORRECT"
      }
    },
    {
      "evidenceId": "ev_7d9dc6cccb3793679d351d3d",
      "sourceEventId": "review:1",
      "skillCode": "BFS_GRID_TRAVERSAL",
      "evidenceType": "REVIEW_RESULT",
      "occurredAt": "2026-09-12T10:00:00Z",
      "weight": 1.3,
      "observed": {
        "concept": null,
        "recognition": null,
        "implementation": null,
        "independent": 0.85,
        "retention": 0.9,
        "speed": null
      },
      "sourceConfidence": 1.0,
      "context": {
        "problemCode": null,
        "judgeStatus": null,
        "hintLevel": null,
        "solutionViewed": null,
        "independentAttempt": true,
        "reviewSucceeded": true,
        "daysSinceLast": 7,
        "verdict": null
      }
    }
  ],
  "expected": {
    "skillCode": "BFS_GRID_TRAVERSAL",
    "concept": 0.9,
    "recognition": null,
    "implementation": 0.9,
    "independent": 0.928,
    "retention": 0.9,
    "speed": null,
    "mastery": 0.9093,
    "confidence": 1.0,
    "evidenceCount": 12,
    "status": "MASTERED"
  }
}
