{
  "name": "review-retention",
  "description": "7일 뒤 복습 성공은 retention 0.90.",
  "skillCode": "BFS_GRID_TRAVERSAL",
  "evidences": [
    {
      "evidenceId": "ev_bde7e2628ad7a59ed015122f",
      "sourceEventId": "submission:1",
      "skillCode": "BFS_GRID_TRAVERSAL",
      "evidenceType": "PROBLEM_SUBMISSION",
      "occurredAt": "2026-09-01T10:00:00Z",
      "weight": 1.0,
      "observed": {
        "concept": null,
        "recognition": null,
        "implementation": 0.9,
        "independent": 0.95,
        "retention": null,
        "speed": null
      },
      "sourceConfidence": 1.0,
      "context": {
        "problemCode": null,
        "judgeStatus": "ACCEPTED",
        "hintLevel": 0,
        "solutionViewed": false,
        "independentAttempt": true,
        "reviewSucceeded": null,
        "daysSinceLast": null,
        "verdict": null
      }
    },
    {
      "evidenceId": "ev_7d9dc6cccb3793679d351d3d",
      "sourceEventId": "review:1",
      "skillCode": "BFS_GRID_TRAVERSAL",
      "evidenceType": "REVIEW_RESULT",
      "occurredAt": "2026-09-08T10:00:00Z",
      "weight": 1.3,
      "observed": {
        "concept": null,
        "recognition": null,
        "implementation": null,
        "independent": 0.85,
        "retention": 0.9,
        "speed": null
      },
      "sourceConfidence": 1.0,
      "context": {
        "problemCode": null,
        "judgeStatus": null,
        "hintLevel": null,
        "solutionViewed": null,
        "independentAttempt": true,
        "reviewSucceeded": true,
        "daysSinceLast": 7,
        "verdict": null
      }
    }
  ],
  "expected": {
    "skillCode": "BFS_GRID_TRAVERSAL",
    "concept": null,
    "recognition": null,
    "implementation": 0.9,
    "independent": 0.928,
    "retention": 0.9,
    "speed": null,
    "mastery": 0.9117,
    "confidence": 0.2875,
    "evidenceCount": 2,
    "status": "PRACTICING"
  }
}
