{
  "name": "recognition-exam-mode",
  "description": "유형을 숨긴 모드에서만 recognition 을 관측한다. GUIDED 였다면 null 이다.",
  "skillCode": "BFS_GRID_TRAVERSAL",
  "evidences": [
    {
      "evidenceId": "ev_bde7e2628ad7a59ed015122f",
      "sourceEventId": "submission:1",
      "skillCode": "BFS_GRID_TRAVERSAL",
      "evidenceType": "PROBLEM_SUBMISSION",
      "occurredAt": "2026-09-01T10:00:00Z",
      "weight": 1.0,
      "observed": {
        "concept": null,
        "recognition": 0.9,
        "implementation": 0.9,
        "independent": 0.95,
        "retention": null,
        "speed": null
      },
      "sourceConfidence": 1.0,
      "context": {
        "problemCode": null,
        "judgeStatus": "ACCEPTED",
        "hintLevel": 0,
        "solutionViewed": false,
        "independentAttempt": true,
        "reviewSucceeded": null,
        "daysSinceLast": null,
        "verdict": null
      }
    }
  ],
  "expected": {
    "skillCode": "BFS_GRID_TRAVERSAL",
    "concept": null,
    "recognition": 0.9,
    "implementation": 0.9,
    "independent": 0.95,
    "retention": null,
    "speed": null,
    "mastery": 0.9179,
    "confidence": 0.125,
    "evidenceCount": 1,
    "status": "PRACTICING"
  }
}
